{
  "case_id": "5f0c2a7e-3b1d-4c8a-9e21-7a4d0b6c1f02",
  "status": "released",
  "status_reason": null,
  "scan_id": "c1a9d3e4-52b7-4f60-8a1c-0d9e8f7a6b54",
  "report_sha256": "eaf1de6cbb2d576949f1a39333d9b9052dce8ebf5424b4379866cfcc85802380",
  "received_at": "2026-10-03T14:06:41Z",
  "expires_at": "2026-10-10T14:06:41Z",
  "poll_after_seconds": null,
  "result": {
    "result_schema_version": "1.0",
    "case_id": "5f0c2a7e-3b1d-4c8a-9e21-7a4d0b6c1f02",
    "scan_id": "c1a9d3e4-52b7-4f60-8a1c-0d9e8f7a6b54",
    "report_sha256": "eaf1de6cbb2d576949f1a39333d9b9052dce8ebf5424b4379866cfcc85802380",
    "revision": 1,
    "released_at": "2026-10-03T18:20:05Z",
    "origin": "ai_assisted_human_reviewed",
    "summary": "Die Abstürze fallen zeitlich mit Fehlern des Grafiktreibers zusammen. Das belegt keinen Defekt der Grafikkarte.",
    "facts": [
      {
        "id": "fact-1",
        "text": "Zwischen 13:38 und 13:41 UTC wurden vier Fehler der Quelle nvlddmkm (Ereignis 153) erfasst.",
        "references": [
          {
            "kind": "finding",
            "id": "f-001"
          },
          {
            "kind": "device",
            "id": "dev-01"
          }
        ]
      },
      {
        "id": "fact-2",
        "text": "Der Grafiktreiber hat die Version 32.0.15.6094 vom 14.08.2026.",
        "references": [
          {
            "kind": "device",
            "id": "dev-01"
          }
        ]
      },
      {
        "id": "fact-3",
        "text": "Die Erfassung der WLAN-Ereignisse war nicht verfügbar; dazu gibt es keine Aussage.",
        "references": [
          {
            "kind": "report_field",
            "pointer": "/collection/wlan_events"
          }
        ]
      }
    ],
    "hypotheses": [
      {
        "text": "Der aktuelle Grafiktreiber könnte unter Last instabil sein. Das ist nicht belegt.",
        "proven": false,
        "fact_refs": [
          "fact-1",
          "fact-2"
        ]
      }
    ],
    "next_steps": [
      {
        "title": "Absturz ohne Addons nachstellen",
        "rationale": "Trennt ein Addon-Problem von einem Treiber- oder Hardwareproblem.",
        "instructions": "Im Battle.net-Launcher WoW starten, in der Charakterauswahl unter Addons alle deaktivieren und denselben Schlachtzug erneut spielen.",
        "risk_class": "read_only",
        "required_privileges": "none",
        "expected_outcome": "Tritt der Absturz weiter auf, sind Addons als Ursache unwahrscheinlich.",
        "rollback": "Addons in der Charakterauswahl wieder aktivieren.",
        "abort_condition": null
      }
    ],
    "open_questions": [
      "Tritt der Absturz auch in anderen Spielen auf?"
    ],
    "warnings": [
      "Bitte kein BIOS-Update und keine Treiberinstallation ohne Rücksprache.",
      "Dieser Text wird nur angezeigt: <script>alert(1)</script> und [Link](https://example.invalid) bleiben wirkungsloser Plaintext."
    ],
    "sources": [
      {
        "title": "SYNTHETISCHE Quelle, kein echter Artikel",
        "url": "https://support.example.invalid/artikel/1"
      }
    ]
  }
}