{
  "case_id": "5f0c2a7e-3b1d-4c8a-9e21-7a4d0b6c1f02",
  "status": "analyzing",
  "status_reason": null,
  "scan_id": "c1a9d3e4-52b7-4f60-8a1c-0d9e8f7a6b54",
  "report_sha256": "eaf1de6cbb2d576949f1a39333d9b9052dce8ebf5424b4379866cfcc85802380",
  "received_at": "2026-10-03T14:06:41Z",
  "expires_at": "2026-10-10T14:06:41Z",
  "poll_after_seconds": 10,
  "result": null
}